{
  "metadata": {
    "name": "Hydraulic Chain \u2014 Mixed Providers (pump_1 via IDAES)",
    "description": "Only pump_1 delegated to IDAES; remaining units fall back to default CoolProp.",
    "version": "2.0"
  },
  "providers": {
    "coolprop": {
      "type": "coolprop"
    },
    "idaes": {
      "type": "idaes"
    }
  },
  "materials": {
    "Water": {
      "id": 1
    },
    "Toluene": {
      "id": 2
    },
    "Steel": {
      "id": 3
    }
  },
  "material_mixes": {
    "Water_Toluene_Mix": {
      "id": 1,
      "percent_type": "ao",
      "components": [
        {
          "name": "Water",
          "fraction": 0.8
        },
        {
          "name": "Toluene",
          "fraction": 0.2
        }
      ]
    }
  },
  "streams": {
    "feed": {
      "T": 298.15,
      "P": 101325,
      "flowrate": 1.0,
      "material_mix": 1
    }
  },
  "units": {
    "pump_1": {
      "type": "Pump",
      "in": "feed",
      "out": "after_pump_1",
      "delta_p": 100000.0,
      "efficiency": 0.75,
      "material": 3,
      "provider": "idaes"
    },
    "pipe_1": {
      "type": "Pipes",
      "in": "after_pump_1",
      "out": "after_pipe_1",
      "delta_p": 1000.0,
      "diameter": 0.05,
      "material": 3
    },
    "valve_1": {
      "type": "Valve",
      "in": "after_pipe_1",
      "out": "after_valve_1",
      "pressure_ratio": 0.5,
      "material": 3
    },
    "pipe_2": {
      "type": "Pipes",
      "in": "after_valve_1",
      "out": "after_pipe_2",
      "delta_p": 1000.0,
      "diameter": 0.08,
      "material": 3
    },
    "strainer_1": {
      "type": "Strainer",
      "in": "after_pipe_2",
      "out": "after_strainer_1",
      "delta_p": 5000.0,
      "material": 3
    },
    "pipe_3": {
      "type": "Pipes",
      "in": "after_strainer_1",
      "out": "after_pipe_3",
      "delta_p": 1000.0,
      "diameter": 0.1,
      "material": 3
    },
    "pump_2": {
      "type": "Pump",
      "in": "after_pipe_3",
      "out": "after_pump_2",
      "delta_p": 200000.0,
      "efficiency": 0.8,
      "material": 3
    },
    "pipe_4": {
      "type": "Pipes",
      "in": "after_pump_2",
      "out": "product",
      "delta_p": 1000.0,
      "diameter": 0.12,
      "material": 3
    }
  },
  "simulation": {
    "mode": "steady",
    "t0": 0.0,
    "tf": 15.0,
    "dt": 1.0
  }
}