{
  "metadata": {
    "name": "Festim Dynamic Loop",
    "description": "A closed loop to test dynamic H2 depletion via a Festim membrane.",
    "version": "1.0"
  },
  "providers": {
    "festim": {
      "type": "festim"
    }
  },
  "materials": {
    "H2": {
      "id": 1
    },
    "tungsten": {
      "id": 3,
      "D_0": 4.1e-7,
      "E_D": 0.39,
      "S_0": 4.28e-5,
      "E_S": 0.26
    }
  },
  
  "streams": {
    "feed": {
      "T": 300.0,
      "P": 1000000,
      "flowrate": 0.1,
      "z": { "H2": 1.0 }
    }
  },
  "units": {
    "membrane": {
      "type": "FestimMembrane",
      "provider": "festim",
      "in": "feed",
      "retentate_out": "recycle",
      "permeate_out": "waste",
      "thickness": 0.005,
      "mesh_cells": 50,
      "area": 10.0,
      "material": 3
    }
  },
  "simulation": {
    "mode": "dynamic",
    "t0": 0.0,
    "tf": 10.0,
    "dt": 1.0
  }
}
